<?xml version="1.0" encoding="utf-8"?>
<!DOCTYPE install SYSTEM "http://dev.joomla.org/xml/1.5/component-install.dtd">
<install type="component" version="1.5.0">
	<name>JDevTools</name>
	<!-- The following elements are optional and free of formatting conttraints -->
	<creationDate>21-Sep-2007</creationDate>
	<author>Sam Moffatt</author>
	<authorEmail>S.Moffatt@toowoomba.qld.gov.au</authorEmail>
	<authorUrl>http://www.toowoomba.qld.gov.au</authorUrl>
	<copyright>Copyright (c) 2007 Toowoomba City Council/Sam Moffatt</copyright>
	<license>GNU GPL</license>
	<!--  The version string is recorded in the components table -->
	<version>0.1</version>
 	<!-- The description is optional and defaults to the name -->
	<description>This component is designed to help a developer interacting with Joomla! Code</description>

	<!-- Site Main File Copy Section -->
	<!-- Note the folder attribute: This attribute describes the folder
	      to copy FROM in the package to install therefore files copied
	      in this section are copied from /site/ in the package -->
	<files folder="site">
		<filename>index.html</filename>
		<filename>jdevtools.php</filename>
		<filename>controller.php</filename>
		<filename>views/index.html</filename>
		<filename>views/jdevtools/index.html</filename>
		<filename>views/jdevtools/view.html.php</filename>
		<filename>views/jdevtools/tmpl/index.html</filename>
		<filename>views/jdevtools/tmpl/default.php</filename>
		<filename>models/jdevtools.php</filename>
	</files>
	<install>
		<sql>
			<file charset="utf8" driver="mysql">install.sql</file>
		</sql>
	</install>
	<uninstall>
		<sql>
			<file charset="utf8" driver="mysql">uninstall.sql</file>
		</sql>
	</uninstall>

	<administration>
		<!-- Administration Menu Section -->
		<menu>Development Tools</menu>
  
		<!-- Administration Main File Copy Section -->
		<files folder="admin">
			<filename>index.html</filename>
			<filename>admin.jdevtools.php</filename>
		</files>  
	</administration>
</install>