<?xml version="1.0" encoding="utf-8"?>
<!DOCTYPE install SYSTEM "http://dev.joomla.org/xml/1.5/component-install.dtd">
<install type="component" version="1.5.0">
 <name>Migration Assistant</name>
 <!-- The following elements are optional and free of formatting conttraints -->
 <creationDate>11-Feb-2008</creationDate>
 <author>Sam Moffatt</author>
 <authorEmail>pasamio@gmail.com</authorEmail>
 <authorUrl>http://sammoffatt.com.au</authorUrl>
 <copyright>Copyright (c) 2008 Toowoomba City Council/Sam Moffatt</copyright>
 <license>GNU GPL</license>
 <!--  The version string is recorded in the components table -->
 <version id="1">1.5</version>
 <!-- The description is optional and defaults to the name -->
 <description>This component copies across the values in the migration configuration table</description>
 <administration>
  <!-- Administration Menu Section -->
  <menu>Migration Assistant</menu>
  
  <!-- Administration Main File Copy Section -->
  <files folder="admin">
		<filename>admin.migrationassistant.php</filename>
		<filename>index.html</filename>
  </files>  
 </administration>
 <update>http://www.jsitepoint.com/update/components/migrationassistant</update>
</install>